{
  "schema_version": "1.0.0",
  "language": "zh-CN",
  "target_models": ["Z-Image", "Z-Image-Turbo"],
  "validation": {
    "reference_rules": "passed",
    "logic_tests": "passed",
    "model_image_tests": "pending"
  },
  "source_libraries": [
    "core_v1.json",
    "pose_v1.json",
    "scene_v1.json",
    "camera_visual_v1.json",
    "detail_props_v1.json",
    "advanced_extensions_v1.json",
    "theme_media_v1.json"
  ],
  "precedence": [
    "adult_safety",
    "user_lock",
    "structural_rule",
    "dependency_rule",
    "visibility_rule",
    "compatibility_preference",
    "random_fill",
    "density_trim"
  ],
  "runtime_policy": {
    "adult_safety":"reject_unsafe_autofill_and_locked_values",
    "control_only_fields":["scene.indoor_family","theme.category"],
    "default_nonempty_fields":["person.ethnicity"],
    "intentional_empty":"allow_explicit_not_used_and_all_empty",
    "user_lock_conflict":"preserve_user_values_and_skip_conflicting_autofill",
    "preference_merge":"weighted_intersection_then_highest_weight",
    "empty_intersection":"fall_back_to_selected_recipe_pool",
    "bundle_partial_lock":"filter_compatible_bundles_before_random_choice",
    "visibility_omit":"omit_only_auto_generated_fields",
    "density_trim":"trim_only_auto_generated_optional_fields",
    "determinism":"all_random_choices_use_node_seed"
  },
  "composition_rules": [
    {
      "id":"person_age_ethnicity_identity",
      "label":"年龄与族裔身份合句",
      "input_fields":["person.age","person.ethnicity"],
      "value_source":"fragment",
      "templates":{
        "both":"一位{person.age}的{person.ethnicity}成年女性",
        "first_only":"一位{person.age}的成年女性",
        "second_only":"一位{person.ethnicity}成年女性"
      },
      "policy":"年龄阶段使用中点年龄作为视觉锚点；地域族裔分支启用时替代族裔大类进入人物身份短句。族裔只控制身份，不自动推导肤色、五官、发色、发型、服装或场景。"
    }
  ],
  "override_groups": [
    {
      "id":"detailed_makeup_overrides_simple",
      "label":"精细妆容覆盖简易妆容",
      "trigger_fields":["makeup.base","makeup.eyebrow","makeup.eyeshadow","makeup.eyeliner","makeup.eyelash","makeup.blush","makeup.lip_color","makeup.lip_finish"],
      "clear_fields":["person.makeup"],
      "policy":"当任一精细妆容字段被启用时，省略简易整套妆容字段。"
    },
    {
      "id":"detailed_earrings_override_legacy",
      "label":"详细耳饰覆盖旧配饰耳饰",
      "trigger_fields":["jewelry.earrings"],
      "clear_values":{"clothing.accessory":["pearl_studs","pearl_drop","metal_tassel","gold_hoops","geometric_earrings"]},
      "policy":"详细耳饰已选时，不再输出旧配饰字段中的耳饰。"
    },
    {
      "id":"detailed_necklace_overrides_legacy",
      "label":"详细项链覆盖旧配饰项链",
      "trigger_fields":["jewelry.necklace"],
      "clear_values":{"clothing.accessory":["fine_necklace","pearl_necklace"]},
      "policy":"详细项链已选时，不再输出旧配饰字段中的项链。"
    },
    {
      "id":"detailed_eyewear_overrides_legacy",
      "label":"详细眼镜覆盖旧配饰眼镜",
      "trigger_fields":["accessory.eyewear"],
      "clear_values":{"clothing.accessory":["rectangle_glasses","round_glasses"]},
      "policy":"详细眼镜已选时，不再输出旧配饰字段中的眼镜。"
    },
    {
      "id":"detailed_bag_overrides_legacy",
      "label":"详细手袋覆盖旧配饰手袋",
      "trigger_fields":["accessory.bag"],
      "clear_values":{"clothing.accessory":["structured_handbag","shoulder_bag"]},
      "policy":"详细手袋已选时，不再输出旧配饰字段中的手袋。"
    },
    {
      "id":"detailed_wrist_overrides_legacy",
      "label":"详细腕饰覆盖旧腕表",
      "trigger_fields":["jewelry.wrist"],
      "clear_values":{"clothing.accessory":["wristwatch"]},
      "policy":"详细腕部配件已选时，不再输出旧配饰字段中的腕表。"
    },
    {
      "id":"indoor_location_overrides_simple_location",
      "label":"详细室内地点覆盖基础地点",
      "trigger_fields":["scene.indoor_location"],
      "clear_fields":["scene.location"],
      "policy":"详细室内地点启用后，不再重复输出基础场景地点。"
    }
  ],
  "structural_rules": [
    {
      "id":"dress_structure",
      "label":"连衣裙结构",
      "when":{"field":"clothing.mode","values":["dress"]},
      "require_fields":["clothing.dress_type"],
      "clear_fields":["clothing.top_type","clothing.bottom_type"],
      "policy":"连衣裙模式只保留连衣裙款式。"
    },
    {
      "id":"separates_structure",
      "label":"上下装结构",
      "when":{"field":"clothing.mode","values":["separates","suit"]},
      "require_fields":["clothing.top_type","clothing.bottom_type"],
      "clear_fields":["clothing.dress_type"],
      "policy":"上下装或套装模式需要上装和下装同时成立。"
    },
    {
      "id":"jumpsuit_structure",
      "label":"连体装结构",
      "when":{"field":"clothing.mode","values":["jumpsuit"]},
      "require_fields":["clothing.jumpsuit_type","clothing.color","clothing.material","clothing.fit_detail"],
      "clear_fields":["clothing.top_type","clothing.bottom_type","clothing.dress_type"],
      "policy":"连体装由结构、颜色、材质和剪裁细节描述。"
    },
    {
      "id":"layered_structure",
      "label":"叠穿结构",
      "when":{"field":"clothing.mode","values":["layered"]},
      "require_any_fields":[["clothing.top_type","clothing.bottom_type"],["clothing.dress_type","clothing.top_type"]],
      "policy":"叠穿至少包含两件可辨认的服装结构。"
    },
    {
      "id":"prop_action_atomic",
      "label":"道具动作原子绑定",
      "when":{"bundle_group":"prop_action_links"},
      "lock_together":["prop.object","pose.hand_action","pose.gaze"],
      "policy":"随机时三项作为一个整体选择；用户锁定其中一项时只从兼容组合补全其余项。"
    },
    {
      "id":"pose_chain_atomic",
      "label":"姿态动作链原子绑定",
      "when":{"bundle_group":"pose_action_chains"},
      "lock_together":["pose.event","pose.base","pose.body_direction","pose.weight","pose.shoulders","pose.hand_action","pose.leg_action","pose.head_direction","pose.gaze","pose.expression"],
      "policy":"随机姿态优先抽取整条动作链。"
    },
    {
      "id":"camera_setup_atomic",
      "label":"摄影方案原子绑定",
      "when":{"bundle_group":"camera_setups"},
      "lock_together":["camera.shot_size","camera.composition","camera.lens","camera.distance","camera.angle","camera.depth","camera.focus"],
      "policy":"随机摄影参数优先抽取完整摄影方案。"
    },
    {
      "id":"lighting_plan_atomic",
      "label":"布光方案原子绑定",
      "when":{"bundle_group":"lighting_plans"},
      "lock_together":["lighting.source","lighting.direction","lighting.quality","lighting.target","lighting.shadow"],
      "policy":"随机光线优先抽取完整布光方案。"
    },
    {
      "id":"hair_style_bundle_atomic",
      "label":"组合发型原子绑定",
      "when":{"bundle_group":"hair_style_bundles"},
      "lock_together":["hair.length","hair.texture","hair.style","hair.bangs"],
      "policy":"组合发型优先整体选择长度、纹理、造型和刘海，发饰作为可选附加项。"
    },
    {
      "id":"advanced_camera_atomic",
      "label":"高级镜头方案原子绑定",
      "when":{"bundle_group":"advanced_camera_effects"},
      "lock_together":["camera.shot_size","camera.composition","camera.lens","camera.angle","camera.depth","camera.focus","camera.framing_effect","camera.optical_effect"],
      "policy":"高级摄影随机时整体选择景别、构图、焦段、机位、景深、对焦、框景与光学效果。"
    },
    {
      "id":"lighting_effect_pair_atomic",
      "label":"人物与环境光效绑定",
      "when":{"bundle_group":"lighting_effect_pairs"},
      "lock_together":["lighting.source","lighting.direction","lighting.quality","lighting.subject_effect","lighting.environment_effect"],
      "policy":"人物局部光效与环境光效从同一套兼容方案中选择。"
    },
    {
      "id":"indoor_scene_atomic",
      "label":"室内场景组合绑定",
      "when":{"bundle_group":"indoor_scene_compositions"},
      "lock_together":["scene.indoor_family","scene.indoor_location","scene.time","scene.detail","scene.surface","scene.spatial"],
      "policy":"室内场景优先整体选择空间大类、具体地点、时间、细节、表面和空间层次。"
    }
  ],
  "visibility_rules": [
    {
      "id":"face_closeup_visibility",
      "label":"面部特写可见度",
      "shot_sizes":["face_closeup"],
      "priority_fields":["person.eye_shape","person.iris_color","person.eyelid","person.skin_tone","person.skin_texture","person.makeup","face.eyebrows","face.nose","face.lip_shape","face.visible_detail","makeup.base","makeup.eyebrow","makeup.eyeshadow","makeup.eyeliner","makeup.eyelash","makeup.blush","makeup.lip_color","makeup.lip_finish","hair.undertone","accessory.eyewear","jewelry.earrings","lighting.subject_effect","camera.optical_effect"],
      "omit_fields":["person.body_build","person.stature","person.line_emphasis","clothing.bottom_type","clothing.legwear","clothing.shoes","accessory.bag","nail.shape","nail.color","nail.finish","pose.leg_action","lighting.environment_effect"],
      "max_optional_details":14
    },
    {
      "id":"head_shoulders_visibility",
      "label":"头肩近景可见度",
      "shot_sizes":["head_shoulders","chest_up"],
      "priority_fields":["person.eye_shape","person.iris_color","person.eyelid","person.skin_tone","person.skin_texture","person.makeup","person.body_build","person.line_emphasis","face.visible_detail","makeup.eyeshadow","makeup.eyeliner","makeup.lip_color","makeup.lip_finish","hair.bangs","hair.headwear","hair.undertone","hair.dye_pattern","jewelry.earrings","jewelry.necklace","accessory.eyewear","clothing.top_type","clothing.dress_type","lighting.subject_effect","camera.framing_effect","camera.optical_effect"],
      "omit_fields":["person.stature","clothing.bottom_type","clothing.legwear","clothing.shoes","accessory.bag","pose.leg_action"],
      "max_optional_details":12
    },
    {
      "id":"half_body_visibility",
      "label":"半身构图可见度",
      "shot_sizes":["waist_up","seated_half"],
      "priority_fields":["person.eye_shape","person.iris_color","person.skin_tone","person.skin_texture","person.makeup","person.body_build","person.line_emphasis","clothing.top_type","clothing.dress_type","clothing.material","clothing.fit_detail","jewelry.earrings","jewelry.necklace","jewelry.wrist","jewelry.rings","accessory.eyewear","prop.object","pose.hand_action","camera.framing_effect","camera.optical_effect","lighting.subject_effect","lighting.environment_effect"],
      "omit_fields":["person.stature","clothing.shoes"],
      "max_optional_details":11
    },
    {
      "id":"three_quarter_visibility",
      "label":"三分之二身可见度",
      "shot_sizes":["three_quarter"],